{
  "spec_version": 1,
  "meta": {
    "title": "Trésorerie sous tension",
    "domain": "finance-entreprise",
    "level": "intermediaire",
    "duration_minutes": 90,
    "players": { "min": 3, "max": 6 },
    "language": "fr",
    "pitch": "Atelier Méca Ouest est rentable mais sa trésorerie fond : en trois phases, l'équipe de direction doit libérer du cash sans abîmer la marge, le service client ni la légalité."
  },
  "learning_objectives": [
    {
      "id": "lo_bfr",
      "statement": "Calculer le BFR en jours de chiffre d'affaires et expliquer son lien avec la trésorerie nette",
      "bloom_level": "appliquer",
      "assessed_by": ["bfr_jours", "q_dso"]
    },
    {
      "id": "lo_leviers",
      "statement": "Comparer les leviers de réduction du BFR (clients, stocks, fournisseurs) et leurs effets secondaires",
      "bloom_level": "analyser",
      "assessed_by": ["d_priorite", "d_fournisseurs", "d_stocks"]
    },
    {
      "id": "lo_financement",
      "statement": "Choisir un financement court terme adapté à une tension de trésorerie et en évaluer le coût",
      "bloom_level": "evaluer",
      "assessed_by": ["d_crise", "frais_financiers", "q_financement"]
    }
  ],
  "context": {
    "company": {
      "name": "Atelier Méca Ouest",
      "sector": "Usinage de précision pour l'aéronautique",
      "size": "pme",
      "description": "PME de 85 salariés, 12 M€ de chiffre d'affaires annuel dont 35 % avec un donneur d'ordre principal ; 9 M€ de coût des ventes et 6 M€ d'achats annuels."
    },
    "situation": "Le carnet de commandes est plein et la marge correcte, mais la trésorerie est tombée à 150 k€ : les clients paient à 75 jours, les stocks représentent 60 jours de coût des ventes et les fournisseurs sont payés à 45 jours.",
    "constraints": [
      "Respecter le plafond légal des délais de paiement fournisseurs",
      "Ne pas laisser le taux de service client descendre sous 90 %",
      "Aucune augmentation de capital possible à court terme"
    ]
  },
  "roles": [
    { "id": "daf", "title": "Directeur·rice administratif·ve et financier·ère", "mission": "Restaurer la trésorerie et choisir les financements" },
    { "id": "resp_achats", "title": "Responsable des achats", "mission": "Négocier avec les fournisseurs sans fragiliser les approvisionnements" },
    { "id": "resp_supply", "title": "Responsable supply chain", "mission": "Réduire les stocks en maintenant le taux de service" }
  ],
  "kpis": [
    { "id": "tresorerie", "name": "Trésorerie nette", "unit": "k€", "initial": 150, "target": 600, "direction": "higher_is_better", "definition": "Fonds de roulement moins besoin en fonds de roulement (FR - BFR)" },
    { "id": "dso", "name": "Délai moyen de paiement clients", "unit": "jours", "initial": 75, "target": 60, "direction": "lower_is_better", "definition": "Créances clients / chiffre d'affaires TTC x 360" },
    { "id": "dio", "name": "Rotation des stocks", "unit": "jours", "initial": 60, "target": 45, "direction": "lower_is_better", "definition": "Stocks / coût des ventes x 360" },
    { "id": "dpo", "name": "Délai moyen de paiement fournisseurs", "unit": "jours", "initial": 45, "target": 60, "direction": "higher_is_better", "definition": "Dettes fournisseurs / achats TTC x 360, plafonné par la loi à 60 jours date de facture" },
    { "id": "bfr_jours", "name": "BFR en jours de CA", "unit": "jours", "initial": 90, "target": 45, "direction": "lower_is_better", "definition": "Approximation du BFR d'exploitation exprimée en jours de chiffre d'affaires", "formula": "dso + dio - dpo" },
    { "id": "taux_service", "name": "Taux de service client", "unit": "%", "initial": 94, "target": 95, "direction": "higher_is_better", "definition": "Part des commandes livrées complètes et à l'heure (OTIF)" },
    { "id": "frais_financiers", "name": "Frais financiers annuels", "unit": "k€", "initial": 40, "target": 40, "direction": "lower_is_better", "definition": "Intérêts, agios, escomptes accordés et commissions de financement sur douze mois" }
  ],
  "phases": [
    {
      "id": "p1_diagnostic",
      "title": "Diagnostic et priorités",
      "duration_minutes": 25,
      "goal": "Comprendre d'où vient la tension de trésorerie et choisir le premier levier",
      "decisions": [
        {
          "id": "d_priorite",
          "role": "daf",
          "prompt": "Par quel levier commencer pour libérer de la trésorerie ?",
          "advisor_npc": "npc_expert_comptable",
          "options": [
            {
              "id": "o_clients",
              "label": "Relancer systématiquement les clients et proposer 1 % d'escompte pour paiement à 30 jours",
              "effects": [
                { "kpi": "dso", "operation": "add", "value": -10, "delay_phases": 1 },
                { "kpi": "tresorerie", "operation": "add", "value": 333, "delay_phases": 1 },
                { "kpi": "frais_financiers", "operation": "add", "value": 30 }
              ],
              "rationale": "Chaque jour de DSO gagné libère environ CA / 360, soit 33 k€ ici : 10 jours libèrent ~333 k€, une fois les nouvelles conditions appliquées. L'escompte accordé est une charge financière (compte 665 du PCG) : 1 % sur ~3 M€ de ventes concernées coûte ~30 k€ par an.",
              "source_refs": ["src_pcg"]
            },
            {
              "id": "o_stocks",
              "label": "Réduire de 30 % les stocks de sécurité",
              "effects": [
                { "kpi": "dio", "operation": "add", "value": -12 },
                { "kpi": "tresorerie", "operation": "add", "value": 300 },
                { "kpi": "taux_service", "operation": "add", "value": -3 }
              ],
              "rationale": "Les stocks sont valorisés au coût : 12 jours de coût des ventes (9 M€ par an) représentent ~300 k€. Baisser les stocks de sécurité sans fiabiliser les prévisions augmente le risque de rupture : le taux de service se dégrade."
            },
            {
              "id": "o_decouvert",
              "label": "Négocier une autorisation de découvert de 200 k€",
              "effects": [
                { "kpi": "tresorerie", "operation": "add", "value": 200 },
                { "kpi": "frais_financiers", "operation": "add", "value": 14 }
              ],
              "rationale": "Le découvert finance un besoin durable (le BFR) par une ressource de court terme, coûteuse (~7 % par an) et révocable : il soulage la trésorerie sans traiter la cause."
            }
          ]
        }
      ],
      "events": []
    },
    {
      "id": "p2_plan",
      "title": "Plan d'action fournisseurs et stocks",
      "duration_minutes": 30,
      "goal": "Agir sur les délais fournisseurs et les stocks sans enfreindre la loi ni dégrader le service",
      "decisions": [
        {
          "id": "d_fournisseurs",
          "role": "resp_achats",
          "prompt": "Quelles conditions de paiement proposer aux fournisseurs ?",
          "advisor_npc": "npc_expert_comptable",
          "options": [
            {
              "id": "o_dpo_60",
              "label": "Négocier un paiement à 60 jours date de facture en échange de commandes groupées",
              "effects": [
                { "kpi": "dpo", "operation": "add", "value": 15 },
                { "kpi": "tresorerie", "operation": "add", "value": 250 }
              ],
              "rationale": "La loi plafonne les délais de paiement entre entreprises à 60 jours à compter de la date d'émission de la facture (ou 45 jours fin de mois si le contrat le prévoit) : 15 jours de plus sur 6 M€ d'achats annuels libèrent ~250 k€.",
              "source_refs": ["src_l441_10"]
            },
            {
              "id": "o_dpo_90",
              "label": "Imposer unilatéralement un paiement à 90 jours",
              "effects": [
                { "kpi": "dpo", "operation": "add", "value": 45 },
                { "kpi": "tresorerie", "operation": "add", "value": 750 }
              ],
              "triggers_events": ["e_dgccrf"],
              "rationale": "90 jours dépasse le plafond légal : c'est illégal et passible d'une amende administrative pouvant atteindre 2 M€ pour une personne morale. Le gain de trésorerie est artificiel et expose l'entreprise.",
              "source_refs": ["src_l441_10", "src_l441_16"]
            },
            {
              "id": "o_statu_quo",
              "label": "Conserver les conditions actuelles pour préserver la relation",
              "effects": [],
              "rationale": "Ménager des fournisseurs fragiles peut se justifier, mais l'entreprise renonce à un levier légal et gratuit de financement de son BFR."
            }
          ]
        },
        {
          "id": "d_stocks",
          "role": "resp_supply",
          "prompt": "Comment réduire les stocks sans provoquer de ruptures ?",
          "advisor_npc": "npc_chef_atelier",
          "options": [
            {
              "id": "o_abc",
              "label": "Classer les références en ABC et réduire d'abord le stock des références C",
              "effects": [
                { "kpi": "dio", "operation": "add", "value": -8 },
                { "kpi": "tresorerie", "operation": "add", "value": 200 }
              ],
              "rationale": "La classification ABC (Pareto) concentre l'effort là où la valeur est immobilisée : on réduit le stock dormant sans toucher aux pièces critiques. 8 jours de coût des ventes valent ~200 k€."
            },
            {
              "id": "o_kanban",
              "label": "Mettre en place un réapprovisionnement kanban avec les deux principaux fournisseurs",
              "effects": [
                { "kpi": "dio", "operation": "add", "value": -10, "delay_phases": 1 },
                { "kpi": "tresorerie", "operation": "add", "value": 250, "delay_phases": 1 },
                { "kpi": "taux_service", "operation": "add", "value": 1, "delay_phases": 1 }
              ],